{
  "schema_version": 2,
  "impact_id": "impact.navigation-destination-presentation",
  "change": "added",
  "breaking": false,
  "artifact": "viewcompose-navigation-android",
  "symbol_id": "com.viewcompose.navigation.NavDestinationPresentation",
  "capability_id": "navigation.destination-context",
  "q_level": "Q3",
  "contract_fields": [
    "behavior",
    "outputs",
    "state",
    "lifecycle",
    "concurrency",
    "android",
    "performance",
    "compatibility"
  ],
  "documentation": {
    "kdoc": {
      "status": "updated",
      "targets": ["com.viewcompose.navigation.NavDestinationPresentation"]
    },
    "module": {
      "status": "updated",
      "targets": ["module.viewcompose-navigation-android"]
    },
    "sample": {
      "status": "updated",
      "targets": ["module.navigation-android-destination-context"]
    },
    "reference": {
      "status": "updated",
      "targets": ["reference.navigation.destination-context"]
    },
    "tutorial": {
      "status": "not-applicable",
      "rationale": "The introductory navigation tutorial does not need presentation-role observation to teach its first route transition."
    },
    "guide": {
      "status": "updated",
      "targets": ["guide.navigation-production-host"]
    },
    "architecture": {
      "status": "updated",
      "targets": [
        "architecture.navigation-runtime",
        "architecture.scene-derived-navigation-lifecycle-presentation-ownership"
      ]
    },
    "migration": {
      "status": "updated",
      "targets": ["migration.compose-navigation"]
    },
    "redirect": {
      "status": "not-applicable",
      "rationale": "The capability adds an Android-facing source alias without moving the Core scene value or any documentation route."
    }
  }
}
