{
  "schema_version": 2,
  "impact_id": "impact.viewmodel-scoped-owners-lifecycle211",
  "change": "added",
  "breaking": false,
  "artifact": "viewcompose-viewmodel-androidx",
  "symbol_id": "com.viewcompose.viewmodel.ViewModelScopeProvider",
  "capability_id": "viewmodel.scoped-owners",
  "q_level": "Q3",
  "contract_fields": [
    "behavior",
    "inputs",
    "outputs",
    "state",
    "lifecycle",
    "concurrency",
    "callbacks",
    "failure",
    "android",
    "performance",
    "compatibility"
  ],
  "documentation": {
    "kdoc": {
      "status": "updated",
      "targets": [
        "com.viewcompose.viewmodel.ViewModelScopeProvider",
        "com.viewcompose.viewmodel.ViewModelStoreOwnerLease",
        "com.viewcompose.viewmodel.rememberViewModelScopeProvider",
        "com.viewcompose.viewmodel.rememberViewModelStoreOwner"
      ]
    },
    "module": {
      "status": "updated",
      "targets": ["module.viewcompose-viewmodel-androidx"]
    },
    "sample": {
      "status": "updated",
      "targets": ["module.viewmodel-scoped-owners"]
    },
    "reference": {
      "status": "updated",
      "targets": ["reference.viewmodel.scoped-owners"]
    },
    "tutorial": {
      "status": "not-applicable",
      "rationale": "The compiled module sample owns the general provider workflow; scenario tutorials remain with their Pager, lazy, overlay, or navigation containers."
    },
    "guide": {
      "status": "not-applicable",
      "rationale": "The module manual and retained-scope ADR own stable identity, lease, terminal-removal, recreation, and failure rules without adding a parallel guide."
    },
    "architecture": {
      "status": "updated",
      "targets": ["architecture.retained-viewmodel-scope-ownership"]
    },
    "migration": {
      "status": "updated",
      "targets": ["migration.compose-host-lifecycle-android-interop"]
    },
    "redirect": {
      "status": "not-applicable",
      "rationale": "The additive capability introduces no moved symbol, document route, package, or ownership location."
    }
  }
}
