{
  "schema_version": 2,
  "impact_id": "impact.navigation-result-effect",
  "change": "added",
  "breaking": false,
  "artifact": "viewcompose-navigation-android",
  "symbol_id": "com.viewcompose.navigation.NavResultEffect",
  "capability_id": "navigation.results",
  "q_level": "Q3",
  "contract_fields": [
    "inputs",
    "behavior",
    "outputs",
    "state",
    "lifecycle",
    "concurrency",
    "failure",
    "android",
    "performance",
    "compatibility"
  ],
  "documentation": {
    "kdoc": { "status": "updated", "targets": ["com.viewcompose.navigation.NavResultEffect"] },
    "module": { "status": "updated", "targets": ["module.viewcompose-navigation-android"] },
    "sample": { "status": "updated", "targets": ["module.navigation-android-results"] },
    "reference": { "status": "updated", "targets": ["reference.navigation.results"] },
    "tutorial": {
      "status": "not-applicable",
      "rationale": "Lifecycle-safe result consumption is an integration task beyond the introductory route transition."
    },
    "guide": { "status": "updated", "targets": ["guide.navigation-production-host"] },
    "architecture": { "status": "updated", "targets": ["architecture.navigation-runtime"] },
    "migration": { "status": "updated", "targets": ["migration.compose-navigation"] },
    "redirect": {
      "status": "not-applicable",
      "rationale": "The capability adds one DSL effect without replacing or moving an existing API."
    }
  }
}
